{
  "schema_version": "kangsheng-supported-layout-catalog-v1",
  "catalog_version": "0.1.0",
  "promotion_rule": "SUPPORTED requires two distinct source PDFs of the same structure to pass programmatic generation and full QA without new manual coordinates; SUPPORTED_EXACT permits only SHA-bound frozen replay of registered sources.",
  "layouts": [
    {
      "layout_id": "cn-vector-multiview-split-pcb-table",
      "version": "1.0.0-exact",
      "status": "SUPPORTED_EXACT",
      "applicability_conditions": [
        "single-page vector PDF",
        "portrait source coordinates",
        "multiple product views",
        "multi-part PCB region",
        "part table and performance block"
      ],
      "structure_probe": {
        "page_count": 1,
        "orientation": "portrait",
        "rotation": 0,
        "page_width_pt": [
          594,
          597
        ],
        "page_height_pt": [
          840,
          843
        ],
        "text_extractable": true,
        "text_block_count": [
          23,
          30
        ],
        "drawing_count": [
          900,
          1200
        ],
        "image_count": [
          0,
          0
        ],
        "signals": {
          "tolerance_label": true,
          "performance_label": true,
          "scale_label": true
        }
      },
      "page_orientation": "portrait-source / landscape-output",
      "required_technical_regions": [
        "all dimensional views",
        "PCB and captions",
        "part table",
        "performance",
        "tolerance",
        "projection"
      ],
      "layout_rules": {
        "source_regions": "frozen private recipe only",
        "output_regions": "frozen private recipe only",
        "reason": "two approved exact-source visual replays; no cross-product parameter extractor"
      },
      "region_position_rules": "Each registered source uses only its own frozen private recipe; no cross-source coordinates.",
      "removable_supplier_elements": [],
      "forbidden_deletion": [
        "dimensions",
        "notes",
        "views",
        "PCB",
        "part rows",
        "performance",
        "tolerances",
        "projection",
        "unknown elements"
      ],
      "tolerance_handling": "Preserve this source's values and signs; historical approved visual is not a transcribed default.",
      "pcb_handling": "Keep all source PCB pieces as one engineering assembly; no cross-model parameter copy.",
      "pin_table_handling": "All source part rows and pin counts remain source-bound.",
      "performance_handling": "Copy source technical content only.",
      "logo_title_handling": "Approved Kangsheng assets and title frame only after brand-vs-technical review.",
      "qa_rules": [
        "source SHA and identity binding",
        "recipe self-hash",
        "engine/fitz/asset/baseline bindings",
        "4x RGB zero-difference visual replay"
      ],
      "observed_golden_count": 2,
      "programmatically_verified_distinct_sources": 2,
      "inapplicable_when": [
        "unknown source SHA",
        "new table/PCB structure",
        "recipe/engine/asset changed",
        "additional technical note",
        "unreviewed brand area"
      ],
      "confidence_requirement": "Exact 256-bit source identity and valid recipe/engine/asset/baseline bindings; no structural-only automation.",
      "fallback": "NEEDS_AI_REVIEW",
      "qa_rules_version": "1.0.0-exact"
    },
    {
      "layout_id": "cn-vector-multiview-single-pcb-short-table",
      "version": "0.1.0",
      "status": "CANDIDATE",
      "applicability_conditions": [
        "single-page vector PDF",
        "portrait source coordinates",
        "multiple product views",
        "single PCB region",
        "short part table and performance block"
      ],
      "structure_probe": {
        "page_count": 1,
        "orientation": "portrait",
        "rotation": 0,
        "page_width_pt": [
          594,
          597
        ],
        "page_height_pt": [
          840,
          843
        ],
        "text_extractable": true,
        "text_block_count": [
          15,
          22
        ],
        "drawing_count": [
          950,
          1600
        ],
        "image_count": [
          0,
          0
        ],
        "signals": {
          "tolerance_label": true,
          "performance_label": true,
          "scale_label": true
        }
      },
      "page_orientation": "portrait-source / landscape-output",
      "required_technical_regions": [
        "all dimensional views",
        "PCB and captions",
        "part table",
        "performance",
        "tolerance",
        "projection"
      ],
      "layout_rules": {
        "source_regions": null,
        "output_regions": null,
        "reason": "approved NTS-direction version has no verified final PDF and no generic source parser"
      },
      "region_position_rules": "No reusable coordinates certified; preserve the already-decided NTS policy in isolated reproduction.",
      "removable_supplier_elements": [],
      "forbidden_deletion": [
        "dimensions",
        "notes",
        "views",
        "PCB",
        "part rows",
        "performance",
        "tolerances",
        "projection",
        "unknown elements"
      ],
      "tolerance_handling": "Use this source's exact tolerance values and signs.",
      "pcb_handling": "Preserve source PCB parameters; never reuse another model's positions or dimensions.",
      "pin_table_handling": "Retain each source part row and pin count.",
      "performance_handling": "Copy source technical content only.",
      "logo_title_handling": "Approved Kangsheng assets, title structure and NTS treatment; baseline conflict must be resolved without changing historical PDF.",
      "qa_rules": [
        "source hash and identity",
        "full-page source coverage",
        "uniform geometry transforms",
        "all technical groups",
        "NTS visual check",
        "golden visual comparison"
      ],
      "observed_golden_count": 2,
      "programmatically_verified_distinct_sources": 0,
      "inapplicable_when": [
        "unseen PCB or part-table structure",
        "additional technical notes",
        "watermark ambiguity",
        "content overlaps"
      ],
      "confidence_requirement": "No automatic generation while CANDIDATE; future generic promotion requires >=0.99 structure confidence plus two-source validation.",
      "fallback": "NEEDS_AI_REVIEW",
      "qa_rules_version": "0.1.0-candidate"
    },
    {
      "layout_id": "cn-vector-battery-multiview-pcb",
      "version": "1.0.0-exact",
      "status": "SUPPORTED_EXACT",
      "applicability_conditions": [
        "single-page rotated vector PDF",
        "front/side/rear/isometric/pin views",
        "PCB region",
        "part table and performance block"
      ],
      "structure_probe": {
        "page_count": 1,
        "orientation": "landscape",
        "rotation": 270,
        "page_width_pt": [
          840,
          843
        ],
        "page_height_pt": [
          594,
          597
        ],
        "text_extractable": true,
        "text_block_count": [
          20,
          30
        ],
        "drawing_count": [
          700,
          950
        ],
        "image_count": [
          0,
          0
        ],
        "signals": {
          "pcb_label": true,
          "part_number_header": true,
          "performance_label": true,
          "tolerance_label": true
        }
      },
      "page_orientation": "rotated landscape-source / landscape-output",
      "required_technical_regions": [
        "five product views",
        "PCB and captions",
        "part table",
        "performance",
        "tolerance",
        "projection"
      ],
      "layout_rules": {
        "source_regions": "frozen private recipe only",
        "output_regions": "frozen private recipe only",
        "reason": "one approved exact-source visual replay; second same-structure source not yet verified"
      },
      "region_position_rules": "Only the registered source SHA may use its frozen private recipe.",
      "removable_supplier_elements": [],
      "forbidden_deletion": [
        "dimensions",
        "notes",
        "views",
        "PCB",
        "part rows",
        "performance",
        "tolerances",
        "projection",
        "unknown elements"
      ],
      "tolerance_handling": "Preserve source values; keep the accepted right-edge single-line treatment.",
      "pcb_handling": "Copy source PCB geometry only.",
      "pin_table_handling": "Retain all source part rows and pin counts.",
      "performance_handling": "Copy source technical content only.",
      "logo_title_handling": "Approved Kangsheng assets and accepted title frame only.",
      "qa_rules": [
        "source SHA and identity binding",
        "recipe self-hash",
        "engine/fitz/asset/baseline bindings",
        "4x RGB zero-difference visual replay",
        "accepted single right-edge line"
      ],
      "observed_golden_count": 1,
      "programmatically_verified_distinct_sources": 1,
      "inapplicable_when": [
        "unknown source SHA",
        "new PCB/table structure",
        "recipe/engine/asset changed",
        "additional technical note",
        "border ambiguity"
      ],
      "confidence_requirement": "Exact 256-bit source identity and valid recipe/engine/asset/baseline bindings; no structural-only automation.",
      "fallback": "NEEDS_AI_REVIEW",
      "qa_rules_version": "1.0.0-exact"
    },
    {
      "layout_id": "en-vector-multiview-pcb-bom-exact",
      "version": "1.0.0-exact",
      "status": "SUPPORTED_EXACT",
      "applicability_conditions": [
        "single-page rotated vector PDF",
        "English engineering title",
        "four product views",
        "PCB",
        "BOM/material table",
        "performance block",
        "same source SHA as a frozen approved recipe"
      ],